<?xml version="1.0" encoding="UTF-8"?>

<!-- generated on 2024-06-28 11:41:54 by Eclipse SUMO netedit Version v1_20_0+0903-50ed8d6b852
This data file and the accompanying materials
are made available under the terms of the Eclipse Public License v2.0
which accompanies this distribution, and is available at
http://www.eclipse.org/legal/epl-v20.html
This file may also be made available under the following Secondary
Licenses when the conditions for such availability set forth in the Eclipse
Public License 2.0 are satisfied: GNU General Public License, version 2
or later which is available at
https://www.gnu.org/licenses/old-licenses/gpl-2.0-standalone.html
SPDX-License-Identifier: EPL-2.0 OR GPL-2.0-or-later
<neteditConfiguration xmlns:xsi="http://www.w3.org/2001/XMLSchema-instance" xsi:noNamespaceSchemaLocation="http://sumo.dlr.de/xsd/neteditConfiguration.xsd">

    <input>
        <additional-files value="C:\Users\alva_pa\.texttest\tmp\netedit.gui.28Jun114019.6628\netedit.gui\network\junctions\inspect\id\additionals.add.xml"/>
        <route-files value="C:\Users\alva_pa\.texttest\tmp\netedit.gui.28Jun114019.6628\netedit.gui\network\junctions\inspect\id\routes.rou.xml"/>
        <data-files value="C:\Users\alva_pa\.texttest\tmp\netedit.gui.28Jun114019.6628\netedit.gui\network\junctions\inspect\id\datas.dat.xml"/>
        <sumo-net-file value="D:\Netedit_dev\tests\netedit\network\junctions\inspect\net.net.xml"/>
    </input>

    <output>
        <write-license value="true"/>
    </output>

    <processing>
        <geometry.min-radius.fix.railways value="false"/>
        <geometry.max-grade.fix value="false"/>
        <offset.disable-normalization value="true"/>
        <lefthand value="0"/>
    </processing>

    <junctions>
        <no-turnarounds value="true"/>
        <junctions.corner-detail value="5"/>
        <junctions.limit-turn-speed value="5.50"/>
        <rectangular-lane-cut value="0"/>
    </junctions>

    <pedestrian>
        <walkingareas value="0"/>
    </pedestrian>

    <netedit>
        <ignore-supermode-question value="true"/>
    </netedit>

    <visualisation>
        <gui-settings-file value="C:\Users\alva_pa\.texttest\tmp\netedit.gui.28Jun114019.6628\netedit.gui\network\junctions\inspect\id\gui-settings.xml"/>
        <window-size value="1280, 720"/>
        <window-pos value="50,50"/>
        <gui-testing value="true"/>
        <gui-testing.setting-output value="C:\Users\alva_pa\.texttest\tmp\netedit.gui.28Jun114019.6628\netedit.gui\network\junctions\inspect\id\guisettingsoutput.xml"/>
    </visualisation>

    <report>
        <no-warnings value="true"/>
        <error-log value="C:\Users\alva_pa\.texttest\tmp\netedit.gui.28Jun114019.6628\netedit.gui\network\junctions\inspect\id\log.txt"/>
    </report>

</neteditConfiguration>
-->

<nodes version="1.20" xmlns:xsi="http://www.w3.org/2001/XMLSchema-instance" xsi:noNamespaceSchemaLocation="http://sumo.dlr.de/xsd/nodes_file.xsd">
    <location netOffset="0.00,0.00" convBoundary="-60.00,-30.00,60.00,30.00" origBoundary="-10000000000.000000,-10000000000.000000,10000000000.000000,10000000000.000000" projParameter="+proj=merc +a=6378137 +b=6378137 +lat_ts=0.0 +lon_0=0.0 +x_0=0.0 +y_0=0 +k=1.0 +units=m +nadgrids=@null +wktext +no_defs"/>

    <node id="JunctionBot" x="0.00" y="-25.00" type="dead_end"/>
    <node id="JunctionCenter" x="0.00" y="0.00" type="priority"/>
    <node id="JunctionExtern0" x="-60.00" y="0.00" type="priority"/>
    <node id="JunctionExtern1" x="60.00" y="0.00" type="priority"/>
    <node id="JunctionLeft" x="-25.00" y="0.00" type="dead_end"/>
    <node id="JunctionRight" x="25.00" y="0.00" type="dead_end"/>
    <node id="JunctionTop" x="0.00" y="25.00" type="dead_end"/>
</nodes>
